{
  "$schema": "../icon.schema.json",
  "contributors": [
    "danielbayley",
    "karsa-mistmere"
  ],
  "use-cases": [],
  "tags": [
    "projects",
    "manage",
    "overview",
    "board",
    "tickets",
    "issues",
    "roadmap",
    "plan",
    "intentions",
    "productivity",
    "work",
    "agile",
    "code",
    "coding"
  ],
  "categories": [
    "charts",
    "development"
  ]
}
