{
  "$schema": "../icon.schema.json",
  "contributors": [
    "karsa-mistmere",
    "jguddas",
    "it-is-not",
    "ericfennis"
  ],
  "use-cases": [],
  "tags": [
    "$extends:brain",
    "deep learning",
    "machine learning",
    "computing"
  ],
  "categories": [
    "science",
    "development"
  ]
}
