{
  "$schema": "../icon.schema.json",
  "contributors": [
    "karsa-mistmere"
  ],
  "use-cases": [],
  "tags": [
    "pending",
    "dot",
    "progress",
    "issue",
    "code",
    "coding",
    "version control",
    "choices",
    "multiple choice",
    "choose",
    "album",
    "music",
    "songs",
    "format",
    "cd",
    "dvd",
    "vinyl",
    "sleeve",
    "cover",
    "platinum",
    "compilation",
    "ep",
    "recording",
    "playback",
    "spin",
    "rotate",
    "rpm",
    "dj"
  ],
  "categories": [
    "$extends:circle",
    "development"
  ]
}
