{
  "$schema": "../icon.schema.json",
  "contributors": [
    "karsa-mistmere",
    "ericfennis"
  ],
  "use-cases": [],
  "tags": [
    "emoji",
    "face",
    "happy",
    "good",
    "emotion",
    "react",
    "reaction",
    "add"
  ],
  "categories": [
    "emoji",
    "social",
    "notifications",
    "communication"
  ]
}
