{
  "$schema": "../taxonomy/schemas/icon.schema.json",
  "contributors": [
    "colebemis",
    "danielbayley",
    "jguddas",
    "ericfennis"
  ],
  "use-cases": [],
  "tags": [
    "album",
    "music",
    "songs",
    "format",
    "cd",
    "dvd",
    "vinyl",
    "sleeve",
    "cover",
    "platinum",
    "compilation",
    "ep",
    "recording",
    "playback",
    "spin",
    "rotate",
    "rpm",
    "dj"
  ],
  "categories": [
    "devices",
    "multimedia"
  ]
}
