{
  "$schema": "../icon.schema.json",
  "contributors": [
    "colebemis",
    "ericfennis"
  ],
  "use-cases": [],
  "tags": [
    "$group:direction-left",
    "$group:navigation-previous",
    "previous",
    "sign",
    "turn",
    "button",
    "<-"
  ],
  "categories": [
    "arrows",
    "gaming"
  ],
  "aliases": [
    {
      "name": "arrow-left-circle",
      "deprecationReason": "alias.name",
      "deprecated": true
    }
  ]
}
