{
  "$schema": "../taxonomy/schemas/icon.schema.json",
  "contributors": [
    "jguddas",
    "karsa-mistmere"
  ],
  "use-cases": [],
  "tags": [
    "document",
    "page",
    "file",
    "layout",
    "paper",
    "stub",
    "formality",
    "structure",
    "template",
    "inputs",
    "design",
    "components"
  ],
  "categories": [
    "development"
  ]
}
