{
  "$schema": "../icon.schema.json",
  "contributors": [
    "karsa-mistmere"
  ],
  "use-cases": [
    "marking learner driver status",
    "indicating litre units in measurements",
    "indicating left direction or alignment",
    "representing length in measurements"
  ],
  "tags": [
    "alphabet",
    "character",
    "uppercase",
    "learner",
    "driver",
    "litre",
    "left",
    "length",
    "measurement",
    "text",
    "font",
    "typography"
  ],
  "categories": [
    "letters-digits"
  ]
}
