{
  "$schema": "../icon.schema.json",
  "contributors": [
    "danielbayley",
    "karsa-mistmere"
  ],
  "use-cases": [],
  "tags": [
    "$extends:message-square",
    "typing",
    "writing",
    "responding",
    "ellipsis",
    "etc",
    "et cetera",
    "...",
    "…"
  ],
  "categories": [
    "$extends:message-square"
  ]
}
