{
  "$schema": "../icon.schema.json",
  "contributors": [
    "colebemis",
    "karsa-mistmere",
    "ericfennis"
  ],
  "use-cases": [
    "Represents scheduled communication",
    "Represents send later icons",
    "Indication scheduled mail",
    "Indication delayed delivery features in messaging, email, and productivity tools"
  ],
  "tags": [
    "$extends:mail",
    "scheduled",
    "delayed",
    "send later",
    "delivery",
    "reminder",
    "pending",
    "outgoing",
    "timer"
  ],
  "categories": [
    "$extends:mail",
    "time",
    "notifications",
    "communication"
  ]
}
