{
  "$schema": "../icon.schema.json",
  "contributors": [
    "colebemis",
    "ericfennis",
    "ocavue",
    "jguddas",
    "PeterlitsZo",
    "mittalyashu",
    "juliankellydesign",
    "karsa-mistmere"
  ],
  "use-cases": [],
  "tags": [
    "$extends:list",
    "$group:direction-down",
    "$group:direction-up",
    "items",
    "collapse",
    "expand",
    "details",
    "disclosure",
    "show",
    "hide",
    "toggle",
    "accordion",
    "more",
    "less",
    "fold",
    "unfold"
  ],
  "categories": [
    "$extends:list",
    "arrows"
  ]
}
