{
  "$schema": "../taxonomy/schemas/icon.schema.json",
  "contributors": [
    "karsa-mistmere"
  ],
  "use-cases": [],
  "tags": [
    "badge",
    "medal",
    "honour",
    "decoration",
    "order",
    "pin",
    "laurel",
    "trophy",
    "medallion",
    "insignia",
    "bronze",
    "silver",
    "gold"
  ],
  "categories": [
    "sports",
    "gaming"
  ]
}
