{
  "$schema": "../taxonomy/schemas/icon.schema.json",
  "contributors": [
    "colebemis",
    "ericfennis",
    "danielbayley"
  ],
  "use-cases": [],
  "tags": [
    "movie",
    "video",
    "reel",
    "camera",
    "cinema",
    "entertainment"
  ],
  "categories": [
    "photography",
    "multimedia"
  ]
}
