{
  "$schema": "../icon.schema.json",
  "contributors": [
    "AnnaSasDev",
    "joffx",
    "ericfennis",
    "mittalyashu"
  ],
  "use-cases": [],
  "tags": [
    "$extends:banknote",
    "bill",
    "funds",
    "transaction",
    "cash",
    "finance",
    "deposit",
    "earnings",
    "income",
    "in",
    "credit",
    "prepaid",
    "growth",
    "increase"
  ],
  "categories": [
    "$extends:banknote"
  ]
}
