{
  "$schema": "../icon.schema.json",
  "contributors": [
    "danielbayley",
    "ericfennis",
    "irvineacosta"
  ],
  "use-cases": [],
  "tags": [
    "$extends:panel-top",
    "menu bar",
    "show",
    "reveal",
    "padding",
    "margin",
    "guide",
    "layout",
    "bleed"
  ],
  "categories": [
    "layout"
  ],
  "aliases": [
    {
      "name": "panel-top-inactive",
      "deprecationReason": "alias.name",
      "deprecated": true
    }
  ]
}
